Título;Resumo;Selecionado
Proceedings of the 4th ACM SIGCHI Symposium on Engineering Interactive Computing Systems;The complexity of product line variability models makes it hard to maintain their consistency over time regardless of the modeling approach used. Engineers thus need support for detecting and resolving inconsistencies. We describe experiences of applying a tool-supported approach for incremental consistency checking on variability models. Our approach significantly improves the overall performance and scalability compared to batch-oriented techniques and allows providing immediate feedback to modelers. It is extensible as new consistency constraints can easily be added. Furthermore the approach is flexible as it is not limited to variability models and it also checks the consistency of the models with the underlying code base of the product line. We report the results of a thorough evaluation based on real-world product line models and discuss lessons learned.;
Proceedings of the 2008 ACM Symposium on Applied Computing;Variability management is a common challenge for Software Product Line (SPL) adoption since developers need suitable mechanisms for specifying and implementing variability that occurs at different SPL artifacts (requirements design implementation and test). In this paper we present a novel approach for use case scenario variability management enabling a better separation of concerns between languages used to manage variabilities and languages used to specify use case scenarios. The result is that both representations can be understood and evolved in a separate way. We achieve such a goal by modeling variability management as a crosscutting phenomenon for the reason that artifacts such as feature models product configurations and configuration knowledge crosscut each other with respect to each specific SPL member. After applying our approach to different case studies we achieved a better feature modularity and scenario cohesion.;
Proceedings of the 8th ACM International Conference on Aspect-Oriented Software Development;Organizations are subject to constant evolution and must systematically analyze and design the impact of change to implement it consistently across all organizational domains. A thorough understanding of all relevant business-related artifacts as well as their relationships is a prerequisite to achieve this. For many organizations business architecture management is a means to ensure the correct and up-to-date documentation of these artifacts. One challenge of business architecture management is the development a company-specific business architecture meta model. Two directions of existing work provide partial solutions: (1) generic (meta) modeling methods and (2) business architecture meta models and languages. We argue that these two approaches complement each other and should be applied in an integrated way. The goal of this contribution is to propose such an integrated approach to business architecture engineering. The development of this approach follows the design research process and is based on experiences gained in three industrial business architecture engineering projects.;
Proceedings of the 2009 ACM Symposium on Applied Computing;To develop analyze and evolve today's highly configurable software systems developers need deep knowledge of a system's configuration options e.g. how options need to be set to reach certain locations what configurations to use for testing etc. Today acquiring this detailed information requires manual effort that is difficult expensive and error prone. In this paper we propose iGen a novel lightweight dynamic analysis technique that automatically discovers a program's interactions---expressive logical formulae that give developers rich and detailed information about how a system's configuration option settings map to particular code coverage. iGen employs an iterative algorithm that runs a system under a small set of configurations capturing coverage data processes the coverage data to infer potential interactions and then generates new configurations to further refine interactions in the next iteration. We evaluated iGen on 29 programs spanning five languages the breadth of this study would be unachievable using prior interaction inference tools. Our results show that iGen finds precise interactions based on a very small fraction of the number of possible configurations. Moreover iGen's results confirm several earlier hypotheses about typical interaction distributions and structures.;
Proceedings of the 2016 24th ACM SIGSOFT International Symposium on Foundations of Software Engineering;Model merging is widely recognized as an essential step in a variety of software development activities. During the process of combining a set of related products into a product line or consolidating model views of multiple stakeholders we need to merge multiple input models into one yet most of the existing approaches are applicable to merging only two models. In this paper we define the n-way merge problem. We show that it can be reduced to the known and widely studied NP-hard problem of weighted set packing. Yet the approximation solutions for that problem do not scale for real-sized software models. We thus evaluate alternative approaches of merging models that incrementally process input models in small subsets and propose our own algorithm that considerably improves precision over such approaches without sacrificing performance.;
Proceedings of the 7th International Workshop on Software and Performance;Model-based systems engineering (MBSE) can address many challenges of modern systems development. However due to its comprehensive coverage process maturity improvement can take many directions potentially leading to sub-optimal solutions. Therefore selecting disciplines most aligned to the development team context and goal is key to higher returns on investment. This research aims to relate goals driving MBSE process maturity improvement and candidate capabilities thus providing recommendations that highest yield the expected benefits. For this means we propose a goal-benefit model and respective operationalization method. The model relates MBSE capabilities with benefits generated upon implementation and process improvement goals. Our approach results in a list of MBSE capabilities prioritized according to the improvement goal. The approach was applied to eight development teams located in Germany and Brazil. We also provide a sensitivity analysis to validate the model. The approach was assessed positively by the case study participants who stated that it provides a starting ground for process maturity improvement efforts.;
Proceedings of the International Conference on Software and System Processes and International Conference on Global Software Engineering;Implementation of feature-oriented systems is typically made by creating an admissible configuration according to a specified feature diagram that dictates what artifacts are to be composed to create the desired solution. These artefacts are typically grouped according to the feature they concern. However some artefacts may be related not to a specific feature but to a combination of them. Also multiple alternate implementations of a single feature may exist and the preferred one may be dependent on the specific configuration that is being composed. We propose a graphic model to represent configuration knowledge that is able to address such concerns.;
Proceedings of the First International Workshop on Feature-Oriented Software Development;Software product lining is the act of providing different but related software products under the same brand known as a software product line (SPL). As engineering management and validation of SPLs is far from trivial special solutions for software product line engineering (SPLE) have a continuous momentum in both academic and industry. In general it is hard to judge when to reasonably favor SPLE over alternative solutions that are more common in the industry. In this paper we illustrate how we as Elinvar manage variability within our WealthTech Platform as a Service (PaaS) at different granularity levels and discuss methods for SPLE in this context. More in detail we share our techniques and concepts to address configuration management and show how we manage a single microservice SPL including inter-service communication. Finally we provide insights into platform solutions by means of packages for our clients. We end with a discussion on SPLE techniques in context of service SPLs and our packaging strategy. We conclude that while we are good to go with industry-standard approaches for microservice SPLs the variability modeling and analysis advantages within SPLE is promising for our packaging strategy.;
Proceedings of the 25th ACM International Systems and Software Product Line Conference - Volume B;Feature modeling has emerged as the de-facto standard to compactly capture the variability of a software product line. Multiple feature modeling languages have been proposed that evolved over the last decades to manage industrial-size product lines. However less expressive languages solely permitting require and exclude constraints are permanently and carelessly used in product-line research. We address the problem whether those less expressive languages are sufficient for industrial product lines. We developed an algorithm to eliminate complex cross-tree constraints in a feature model enabling the combination of tools and algorithms working with different feature model dialects in a plug-and-play manner. However the scope of our algorithm is limited. Our evaluation on large feature models including the Linux kernel gives evidence that require and exclude constraints are not sufficient to express real-world feature models. Hence we promote that research on feature models needs to consider arbitrary propositional formulas as cross-tree constraints prospectively.;
Proceedings of the 5th ACM SIGCHI Symposium on Engineering Interactive Computing Systems;For highly configurable software systems such as the Linux kernel maintaining and evolving variability information along changes to source code poses a major challenge. While source code itself may be edited also feature-to-code mappings may be introduced removed or changed. In practice such edits are often conducted ad-hoc and without proper documentation. To support the maintenance and evolution of variability it is desirable to understand the impact of each edit on the variability. We propose the first complete and unambiguous classification of edits to variability in source code by means of a catalog of edit classes. This catalog is based on a scheme that can be used to build classifications that are complete and unambiguous by construction. To this end we introduce a complete and sound model for edits to variability. In about 21.5ms per commit we validate the correctness and suitability of our classification by classifying each edit in 1.7 million commits in the change histories of 44 open-source software systems automatically. We are able to classify all edits with syntactically correct feature-to-code mappings and find that all our edit classes occur in practice.;
Proceedings of the 30th ACM Joint European Software Engineering Conference and Symposium on the Foundations of Software Engineering;In product line engineering (PLE) a major challenge is the complexity of artifacts that have to be handled. In real-world product lines variability models can become large and complex comprising thousands of elements with hundreds of non-trivial dependencies. Visual and interactive techniques aim to reduce the (cognitive) complexity and support the user during challenging PLE tasks like product configuration. There are many visualization techniques described in the literature -- e.g. in Software Visualization -- and some isolated techniques have been applied in PLE tools. Nevertheless the full potential of visualization in the context of PLE has not been exploited so far. This paper provides an overview of (1) available visualization techniques and criteria to judge their benefits and drawbacks for product configuration (2) which have been applied in product configuration in PLE and (3) which could be beneficial to support product configuration. We propose a research agenda for future work in visual and interactive PLE techniques.;
Proceedings of the 15th International Software Product Line Conference Volume 2;The design of a mobile phone application is a tedious task according to its intrinsic variability. Software designers must take into account in their development process the versatility of available platforms (e.g. Android iPhone). In addition to this the variety of existing devices and their divergences (e.g. frontal camera GPS) introduce another layer of complexity in the development process. These two dimensions can be formalized as Software Product Lines (SPL) independently defined. In this paper we use a dedicated metamodel to bridge the gap between an application SPL and a mobile device one. This meta-model is also the support for the product derivation process. The approach is implemented in a framework named Applide and is used to successfully derive customer relationship management software on different devices.;
Proceedings of the 2013 Conference on Internet Measurement Conference;Agile processes like Scrum are increasingly being used in globally distributed contexts. One key reality of the world today is the threat of terrorism. This paper documents the case of a globally distributed Scrum team and shows how this team recovered from a terrorist attack. The team successfully delivered their sprint and the gold release. The main finding of this paper is that if configured correctly such distributed agile processes seem highly resilient in the face of unexpected disasters. Lessons learned from this unique event are also explicated.;
Proceedings of the 2009 Conference of the Center for Advanced Studies on Collaborative Research;Systematic software reuse is still the most promising strategy for increasing productivity and improving quality in the software industry. Although it is simple in concept successful software reuse implementation is difficult in practice. A reason put forward for this is the dependence of software reuse on the context in which it is implemented. This paper describes an interpretive case study aimed at investigating the potential for the implementation of systematic software reuse in a project-centric company. The study confirmed the need for systematic software reuse and identified the reuse issues that could present challenges. The study also revealed a number of problems relating to the project-centric structure for which systematic reuse provides potential solutions.;
Proceedings of the 2008 Annual Research Conference of the South African Institute of Computer Scientists and Information Technologists on IT Research in Developing Countries: Riding the Wave of Technology;Defining organizational processes is essential for enhancing maturity. However the best process depends on the particularities of each project. Typically a process engineer defines a specific process for each project in an ad-hoc fashion which is expensive unrepeatable and error prone. Trying to deal with this challenge we propose a model-based approach to software process tailoring that generates project specific processes based on the organizational process and the project context. The approach is systematic repeatable and it does not depend on the people using it. The proposal has been applied for tailoring the Requirements Engineering process of a medium size company. The obtained results were validated by process engineers of the company. Processes obtained using the proposed approach matched the ones used in the company for planned contexts and also they were reasonable for non-expected situations.;
Proceedings of the 2011 International Conference on Software and Systems Process;Industrial products tend to be customized by third-parties for different use cases. This is currently supported by adding external Programmable Logic Controllers (PLC) to installations. As IoT software ecosystems become wide-spread the need for such hardware will decrease. However removing the controllers opens the challenge of configuring distributed industrial installations. This paper argues for modeling application requirements on industrial installations so that they can be evaluated automatically based on information about targeted installations. GIMLE a visual language for modeling application requirements using expressive domain knowledge is proposed. GIMLE enables modeling requirements on physical features of installations which hasn't received significant attention in the related work. A study with domain experts is used to reflect on the proposed process. The scalability of the visual language is evaluated using a model for a real-world application. The support for reuse of requirements enabled us to build models that can add support for new installations without significant changes and with a slower increase in size the more components can be reused.;
Proceedings of the Seventh International Conference on the Internet of Things;Software design is a process of trading off competing objectives. If the user objective space is rich then we should use optimizers that can fully exploit that richness. For example this study configures software product lines (expressed as feature maps) using various search-based software engineering methods. As we increase the number of optimization objectives we find that methods in widespread use (e.g. NSGA-II SPEA2) perform much worse than IBEA (Indicator-Based Evolutionary Algorithm). IBEA works best since it makes most use of user preference knowledge. Hence it does better on the standard measures (hypervolume and spread) but it also generates far more products with 0% violations of domain constraints. Our conclusion is that we need to change our methods for search-based software engineering particularly when studying complex decision spaces.;
Proceedings of the 2013 International Conference on Software Engineering;In addition to inherited characteristics from software variability service variability exposes two distinct characteristics that impose certain challenges in variability management. These characteristics are: i) Different types of variability and their inter-relationships and ii) Dynamic and recursive variability communication among different stakeholders. This paper elaborates these distinct characteristics in detail with a case study. The challenges brought about by these distinct characteristics in managing variability also are highlighted. We present a review of related work in service variability management and briefly propose our ongoing approach to addressing these challenges.;
Proceedings of the 21st International Conference on Evaluation and Assessment in Software Engineering;Background. Continuous experimentation (CE) has recently emerged as an established industry practice and as a research subject. Our aim is to study the application of CE and A/B testing in various industrial contexts. Objective. We wanted to investigate whether CE is used in different sectors of industry by how it is reported in academic studies. We also wanted to explore the main topics researched to give an overview of the subject and discuss future research directions. Method. We performed a systematic mapping study of the published literature and included 62 papers using a combination of database search and snowballing. Results. Most reported software experiments are done online and with software delivered as a service although varied exemptions exist for e.g. financial software and games. The most frequently researched topics are challenges to conduct experiments and statistical methods for software experiments. Conclusions. The software engineering research on CE is still in its infancy. There are future research opportunities in evaluation research of technical topics and investigations of ethical experimentation. We conclude that the included studies show that A/B testing is applicable to a diversity of software and organisations.;
Proceedings of the 4th International Workshop on Rapid Continuous Software Engineering;The software industry is experiencing a shift towards more open processes a globalized market and more active and engaged customers and end users. This change seems natural and inevitable imposing necessary changes in how software product line organizations plan and drive the development of their products. This paper gives insight into some recent developments in a product line organization and discusses how their efforts have helped them in improving their development processes and their product line. Based on this experience this paper provides some preliminary guidelines to both industry and research indicating that software product line organizations should exploit open innovation engage customers build communities and simplify processes and organization.;
Proceedings of the 2010 ICSE Workshop on Product Line Approaches in Software Engineering;Scoping can be defined as the process of deciding in which parts of an organization's products features and domains systematic reuse is economically useful. It generally is the first phase in product line engineering. For a decade now scoping has been recognized as a discipline of it's own in product line engineering. So it's time to look at what has been done in scoping in the last years and what is still to be done. In this survey we identify and characterize existing scoping approaches with the main goal to derive open areas and research questions for further research in scoping. We analyze and compare existing approaches and derive open and partially addressed research questions that can be tackled by researchers in product line engineering in the next years.;
Proceedings of the 28th ACM International Conference on Design of Communication;Software product lines and model transformations are two techniques used in industry for managing the development of highly complex software. Product line approaches simplify the handling of software variants while model transformations automate software manipulations such as refactoring optimization code generation etc. While these techniques are well understood independently combining them to get the benefit of both poses a challenge because most model transformations apply to individual models while model-level product lines represent sets of models. In this paper we address this challenge by providing an approach for automatically ``lifting'' model transformations so that they can be applied to product lines. We illustrate our approach using a case study and evaluate it through a set of experiments.;
Proceedings of the 8th Working Conference on Mining Software Repositories;Software-as-a-Service is becoming popular in the software business due to its rapid delivery and cost effectiveness in development and maintenance. Software-as-a-Service should be provided in single code base and operated as a single instance. To meet these constraints and requirements from various customers Software-as-a-Service must be highly configurable. To develop configurable Software-as-a-Service it is important to elicit and analyze configuration requirements in the early stages of development. Another issue is that on implementing configuration requirements there are duplicated and untidy code segments. In our study configuration requirements are identified and classified. This study introduces design patterns to remove duplicated codes for configuration.;
Proceedings of the 16th International Software Product Line Conference - Volume 1;Traceability is an important concern for numerous software engineering activities. Establishing traceability links is a challenging and cost-intensive task which is uneconomical without suitable strategies for maintaining high link quality. Current approaches to Traceability Management (TM) however often make important assumptions and choices without ensuring that the consequences and implications for traceability maintenance are feasible and desirable in practice.  In this paper therefore we identify a set of core factors that influence how the quality of traceability links can be maintained. For each factor we discuss relevant challenges and provide guidelines on how best to ensure viable traceability maintenance in a practical TM approach. Our guidelines are meant to be used by tool developers and users to select the most appropriate TM approach for their needs.  Our results are based on and supported by data collected from interviews conducted with: (i) 9 of our industrial and academic project partners to elicit requirements for a TM tool and (ii) 24 software development stakeholders from 15 industrial cases to provide a broader overview of the current state of the practice on TM.  To evaluate the feasibility of our guidelines we investigate a set of existing TM approaches used in industry with respect to our guidelines.;
