Título;Resumo;Selecionado
Proceedings of the 7th International Workshop on Model-Based Methodologies for Pervasive and Embedded Software;Some programming languages especially dynamic programming languages offer suitable mechanisms for the construction of internal domain-specific languages (DSL). Internal DSLs inherit the facilities of their host language such as the availability of libraries frameworks tool support and other DSLs. When developing an internal DSL there are two challenges. First to cope with the host language's syntactic and semantic restrictions. Careful and thoughtful extensions and modifications of the host language are crucial to overcome these restrictions without reverting to poor language design. Second to support several design principles that are genuine for a DSL. Although there is an extensive body of knowledge about DSL design principles and desirable quality properties it remains difficult to apply them or to reason about whether a particular DSL exhibits specific desirable principles.Our objective is to put the two perspectives together. We research the most important design principles of a DSL and show how different patterns can be used to support these principles. This allows us to produce an extensive pattern catalog which is the foundation of principled approach for designing internal DSLs. The patterns can be used to assess the design quality of a DSL and structure its implementation. In particular we show a complex DSL example illustrating each principle and the corresponding patterns. While we stick to Ruby for the explanation and application of the patterns we also name known uses in Python Scala and Smalltalk. Patterns are explained with their context problem forces solution and consequences. We also explain the patterns with the classical structure of intent motivation forces implementation and their consequences. Finally we reflect upon the pattern utilization by discussing their strengths and weaknesses.;
Proceedings of the 17th Conference on Pattern Languages of Programs;Migrating a family of software systems from ad-hoc development approaches such as `clone-and-own' towards software product lines (SPL) is a challenging task. Software architecture recovery techniques can play a crucial role in such a migration. However it is to date still unclear how these techniques which have been mostly developed for single system architecture recovery in mind can be utilized in an SPL context most effectively. In this paper we present a mapping study examining 35 research articles with the purpose of discussing the current state of the art in applying software architecture recovery techniques for SPL and identifying potential research gaps in this area. The results provide evidence that currently used approaches do not seem to consider the potential architectural degradation that might exist in the family of systems to be migrated. Moreover it is hard to generalize across empirical studies as currently it seems difficult to compare and benchmark the approaches applied for software product line architecture (SPLA) extraction/reconstruction.;
Proceedings of the 12th European Conference on Software Architecture: Companion Proceedings;A Model-Driven Software Product Line (MD-SPL) uses metamodels models and transformations to create a family of products using a Model Refinement Line (MRL). However an MD-SPL must evolve and provide mechanisms to add new crosscutting concerns such as security or logging to the applications. Our problem is that we want to preserve and reuse the original MRL. In this paper we present the challenges associated with this problem. We illustrate them by evaluating different model-driven approaches to add crosscutting concerns into an application using high-level aspects. Furthermore we propose an approach to add crosscutting concerns as early aspects and to preserve the original MRL. This approach adds a new MRL that refines a high-level model of the concern. This high-level model is related with the high-level application model in the original MRL. The refinement of the application model and the concern model proceeds in parallel. The presented approach is a work in progress and requires us to tackle several challenges in order to implement and validate the proposal.;
Proceedings of the 14th ACM International Workshop on Context-Oriented Programming and Advanced Modularity;Software solutions in complex environments such as railway control systems or power plants are assemblies of heterogeneous components which are very large and complex systems themselves. Interplay of these systems requires a thorough design of a system-of-systems (SoS) encompassing the required interactions between the involved systems. One of the challenges lies in reconciliation of the domain data structures and runtime constraints to ensure consistency of the SoS behavior. In this paper we present a generative approach that enables reconciliation of a common platform based on reusable domain models of the involved systems. This is comparable to a product line configuration problem where we generate a common platform model for all involved systems. We discuss the specific requirements for model composition in a SoS context and address them in our approach. In particular our approach addresses the operational and managerial independence of the individual systems and offers appropriate modeling constructs. We report on our experiences of applying the approach in several real world projects and share the lessons learned.;
Proceedings of the 12th International Workshop on Variability Modelling of Software-Intensive Systems;Current market developments require organizations to produce high-quality tailored software variants while simultaneously coping with increased software complexity. Software Product Line Engineering (SPLE) is a well-known approach to manage this variability and complexity however no step-wise migration process is available allowing a co-existence of SPLE along with established development processes. In this paper we introduce an incremental SPLE migration strategy and process starting from using the feature model as synchronized product and variant documentation. They can be applied as a first step of SPLE migration along with the continuous software development cycle. We performed initial steps of the process on industrial low voltage drive embedded firmware spanning around few millions lines of code using a commercial SPLE tool and validated short-term benefits by means of stakeholder feedback.;
Proceedings of the XXX Brazilian Symposium on Software Engineering;Convolutional Neural Networks (CNNs) are intensively used to solve a wide variety of complex problems. Although powerful such systems require manual configuration and tuning. To this end we view CNNs as configurable systems and propose an end-to-end framework that allows the configuration evaluation and automated search for CNN architectures. Therefore our contribution is threefold. First we model the variability of CNN architectures with a Feature Model (FM) that generalizes over existing architectures. Each valid configuration of the FM corresponds to a valid CNN model that can be built and trained. Second we implement on top of Tensorflow an automated procedure to deploy train and evaluate the performance of a configured model. Third we propose a method to search for configurations and demonstrate that it leads to good CNN models. We evaluate our method by applying it on image classification tasks (MNIST CIFAR-10) and show that with limited amount of computation and training our method can identify high-performing architectures (with high accuracy). We also demonstrate that we outperform existing state-of-the-art architectures handcrafted by ML researchers. Our FM and framework have been released to support replication and future research.;
Proceedings of the 11th International Symposium on Software Engineering for Adaptive and Self-Managing Systems;Mature development methodologies like software product line engineering or model-driven engineering are more and more adopted in software development. Accordingly the resulting development processes combine artifacts from different disciplines and on different abstraction levels. It is crucial that the relationship between these artifacts is explicitly maintained to be able to track the development process and the reasons for design decisions. This problem becomes exacerbated if variability is considered since it is a cross-cutting concern that impacts all disciplines and artifacts. Traceability links support the linking of artifacts across model boundaries in an end-to-end manner. However existing traceability solutions are either limited to specific development processes tools and artifact types lack in uniformity or do not consider variability. Thus this paper introduces a MOF-based generic traceability metamodel for establishing uniform traceability-enabled workflows in a variability-aware and model-based environment. Necessary steps for instantiating the metamodel to specific artifact types of certain development processes are described. We evaluate the proposed solution with an exemplar of a car headlight and demonstrate the benefits of a consistent traceability concept.;
Proceedings of the 2009 ESEC/FSE Workshop on Software Integration and Evolution @ Runtime;Combining microservices and software product line engineering (SPLE) is a challenge in variability management. This paper proposes a solution to that challenge by re-engineering existing webshop systems into a product line application. We first perform feature identification to analyze the features of subject systems. We introduce a mechanism that models the variability and designs a software product line architecture based on existing features. We use a UML diagram with the UML-DOP profile to abstract microservice variability in SPLE. Then a transformation into a product line application is conducted to generate running applications based on selected features. We utilize a preliminary framework of microservice variability based on delta-oriented programming.;
Proceedings of the 6th Workshop on Scientific Cloud Computing;Software Product Line engineering aims at reusing and automating software development to reduce costs have shorter development cycles and maintain quality. However for organizations with settled development processes and a large code base adopting an SPL approach may prove to be a daunting task. In this paper we present an industrial experimentation and a proposal for an SPL adoption in Heinsohn Business Technology (HBT) a software development company specialized in financial transportation mortgage-backed securities and pension-fund solutions. We start by identifying and modeling multiple levels of variability inherent to the kind of developments undertaken by HBT. Next we define restrictions inside every level as well as between the levels to fully characterize an HBT software product. To limit the impact on the organization development process we use an extractive approach. This allows us to design core assets starting from current software artifacts. The overall approach is based on real-world software artifacts developed over the years by HBT whose combinations result in approximately 4.88e11 possible product configurations.;
Proceedings of the 5th Asia-Pacific Symposium on Internetware;Feature models are a de facto standard for representing the commonalities and variability of product lines and configurable software systems. Requirements-level features are commonly implemented in multiple source code artifacts which results in complex dependencies at the code level. As developers change and evolve features frequently it is challenging to keep feature models consistent with their implementation. We thus present an approach combining feature-to-code mappings and code dependency analyses to inform engineers about possible inconsistencies. Our focus is on code-level changes requiring updates in feature dependencies and constraints. Our approach uses static code analysis and a variation control system to lift complex code-level dependencies to feature models. We present the suggested dependencies to the engineer in two ways: directly as links between features in a feature model and as a heatmap visualizing the dependency changes of all features in a model. We present results of an evaluation on the Pick-and-Place Unit system which demonstrates the utility and performance of our approach and the quality of the suggestions.;
Proceedings of the 18th ACM SIGPLAN International Conference on Generative Programming: Concepts and Experiences;Inadequate version control has been identified as a major obstacle to the application of model-driven software engineering. In particular sophisticated support for merging model versions is urgently needed. We present a tool for merging of EMF models which may be applied to instances of arbitrary Ecore models. The tool advances the state of the art by guaranteeing a consistent merge result. Furthermore it detects and resolves not only context-free but also context-sensitive conflicts. Our merge tool is model-based it relies on EMF for its implementation. Initial experiences gained from its application confirm that the merge tool operates both accurately and efficiently.;
Proceedings of the Workshop on ACadeMics Tooling with Eclipse;Cyber-physical systems i.e. systems that seamlessly integrate computation and physical components are typically highly-configurable systems. Testing such systems is particularly challenging because they comprise a large number of heterogeneous components that can be configured and combined in different ways. Despite a plethora of work investigating software testing in general and software product line testing in particular variability in tests and how industry does actually manage testing highly configurable cyber-physical systems is not well understood. In this paper we report the results of a multiple case study we conducted with three companies developing and maintaining highly-configurable cyber-physical systems focusing on their testing practices with a particular focus on how they manage variability in tests. We conclude that experienced-based selection of configurations for testing is currently predominant. Variability modeling techniques are not utilized and the dependencies between configuration options are only partially modeled at best. However the companies are aware of the situation and have the need and desire to cover more configuration combinations by automated tests. This in turn raises many questions which might also be of interest to the scientific community and motivate future research.;
Proceedings of the 23rd ACM/IEEE International Conference on Model Driven Engineering Languages and Systems;Ideally the variability of a product line is represented completely and correctly by its variability model. However in practice additional variability is often represented on the level of the build system or in the code. Such a situation may lead to inconsistencies where the actually realized variability does not fully correspond to the one described by the variability model. In this paper we focus on configuration mismatches i.e. cases where the effective variability differs from the variability as it is represented by the variability model. While previous research has already shown that these situations still exist even today in well-analyzed product lines like Linux so far it was unclear under what circumstances such issues occur in reality. In particular it is open what types of configuration mismatches occur and how severe they are. Here our contribution is to close this gap by presenting a detailed manual analysis of 80 configuration mismatches in the Linux 4.4.1 kernel and assess their criticality. We identify various categories of configuration issues and show that about two-thirds of the configuration mismatches may actually lead to kernel misconfigurations.;
Proceedings of the 6th ECMFA Traceability Workshop;During the development of embedded software the system context (mechanical electronical business etc.) has to be considered. Typically this context is diverse and highly complex. Moreover the context in which the system is embedded can vary. For example the system can be used in different technical environments or in different countries. This variability in the context influences the software to be developed and typically leads to system variability. This paper systematically analyses the impact of context variability on the system development more precisely on the variability of the system. Related work is discussed and an example from the automotive domain is presented to identify open issues that need to be addressed.;
Proceedings of the 30th Annual ACM Symposium on Applied Computing;This paper presents an aspect-oriented framework which enables dynamically weaving aspects into operating system in order to adjust its functionalities during system operation. The framework is designed based on the notion of dynamic aspect weaving in Aspect-Oriented Programming (AOP) arena which can achieve modulating at runtime the behavior of an existing program by injecting a piece of code (called advice in AOP terminology) at selected location (called join point) of the program. It is useful in making program adaptable especially for non-stopping systems of which in general going off-line for maintenance and undertaking system restart is either unacceptable or too expensive. The design of this framework includes a join point model and management functions on aspects. The join point model supports weaving multiple aspects to the same join point and the chained execution of advices of the same type. The management functions provide the creation deployment and runtime management of aspects in addition to sequencing the execution of advices. An example implementation of this framework working on Linux operating system is described in this paper which demonstrates both the feasibility and the effectiveness of this framework.;
Proceedings of the 2010 ACM Symposium on Applied Computing;Formal verification of variant requirements has gained much interest in the software product line (SPL) community. Feature diagrams are widely used to model product line variants. However there is a lack of precisely defined formal notation for representing and verifying such models. This paper presents an approach to modeling and analyzing SPL variant feature diagrams using first-order logic. It provides a precise and rigorous formal interpretation of the feature diagrams. Logical expressions can be built by modeling variants and their dependencies by using propositional connectives. These expressions can then be validated by any suitable verification tool such as Alloy. A case study of a Computer Aided Dispatch (CAD) system variant feature model is presented to illustrate the analysis and verification process.;
Proceedings of the 26th ACM International Systems and Software Product Line Conference - Volume B;The choice calculus a formal language for representing variation in software artifacts features syntactic forms to map dimensions of variability to local choices between source code variants. However the process of selecting alternatives from dimensions was relegated to an external operation. The lack of a syntactic form for selection precludes many interesting variation and reuse patterns such as nested product lines and theoretical results such as a syntactic description of the configuration process.In this paper we add a selection operation to the choice calculus and illustrate how that increases the expressiveness of the calculus. We investigate some alternative semantics of this operation and study their impact and utility. Specifically we will examine selection in the context of static and dynamically scoped dimension declarations as a well as a linear and comprehensive form of dimension elimination. We also present a design for a type system to ensure configuration safety and modularity of nested product lines.;
Proceedings of the 31st Annual ACM Symposium on Applied Computing;Preprocessors are a common way to implement variability in software. They are used in numerous software systems such as operating systems and databases. Due to the ability of preprocessors to enable and disable code fragments not all parts of the program are active at the same time. Thus programmers and tools need to handle the interactions resulting from annotations in the program. With our Eclipse-based tool FeatureIDE we provide tool support to tackle multiple challenges with preprocessors such as code comprehension feature traceability separation of concerns and program analysis. With FeatureIDE instead of focusing on one particular preprocessor we provide tool support which can easily be adopted for further preprocessors. Currently we support development with CPP Antenna and Munge. https://youtu.be/jVe7f32mLCQ;
Proceedings of the 6th International Workshop on Feature-Oriented Software Development;We address a category of systems whose deployment requires a configuration according to topological information. Although inspired by the case of railway interlocking systems we give a general definition of topologically configurable control systems. We consider the application of product line engineering principles to the development of these systems by discussing the adoption of different approaches to achieve a flexible configuration of products able to factorise most of the design effort as typical in a product line approach.Verifying the behaviour of such systems either by testing or by formal verification is actually a challenge: the intricate relations between the actual topology controlled by a product and its functional requirements may prevent any attempt to factorise analysis activities. We will discuss how the application of product line engineering principles can help with special focus on formal verification pointing to several open research issues.;
Proceedings of the International Conference on Software and System Process;Often either to expand the target market or to satisfy specific new requirements software systems inside a company are cloned refactored and customized generating new derived software systems. Although this is a practical solution it is not effective in the long-term because of the high maintenance costs when maintaining each of these derived software systems. Software product lines (SPLs) were proposed to reduce these costs however the lack of integration between variability realization mechanisms and version control systems reduces its attractiveness in the software development industry especially in small and medium software companies. In this paper we propose an approach to integrate the conditional compilation mechanism used to implement the SPL variabilities and the Git version control system used to manage software versions in order to increase the attractiveness of the SPLs in the industry. The proposed solution also could be seen as a method to manage software system families' evolution in space and time.;
Proceedings of the 7th International Workshop on Feature-Oriented Software Development;This paper describes a demonstration of the product line engineering tool and framework Gears from BigLever software. Gears provides a single feature modeling language a single variation point mechanism and a single automated product configurator that are used to configure a product portfolio's shared engineering assets appropriately for each product in the portfolio. The result is an automated production line capability that can quickly produce any product in the portfolio from the same single set of shared assets.;
Proceedings of the 3rd International Workshop on Variability &amp Composition;Control software for automated production systems (aPs) becomes increasingly complex as it evolves due to changing requirements. To address varying customer demands or altered regulatory guidelines it is common practice to create a new system variant by copying and subsequently modifying existing control software. Referred to as clone-and-own proper documentation is typically not cherished thereby entailing severe maintenance issues in the long-run. To mitigate such problems and to reinstate sustainable development respective software systems need to be compared and their variability information needs to be reverse-engineered. However recent work identified variability management in the domain of aPs to remain a challenging endevour and appropriate tool support to be missing.We bridge this gap and introduce the Variability Analysis Toolkit (VAT) an extensible platform that allows for the customizable definition of metrics to compare IEC61131-3 control software variants as well as providing means to visualize results. The VAT facilitates a working environment that allows for the exchange of produced results between users. By that we aim to support engineers in re-engineering control software systems by providing them with means to define metrics based on their individual demands. We demonstrate the feasibility of the VAT using 24 software system variants implemented in accordance to the IEC61131-3 standard.;
